{"task_id":"standalone-stupidemic-ch1-g3-translation_chunk_test","project_id":"mangadistrict-com-title-stupidemic-uncensored","fencing_token":3,"context_version":"smoke:no-canonical-context","status":"completed","completed_units":["page-001","page-002","page-003","page-004","page-005","page-006","page-007","page-008","page-009","page-010","page-011","page-012","page-013","page-014","page-015","page-016","page-017","page-018","page-019","page-020","page-021","page-022","page-023","page-024","page-025","page-026","page-027","page-028","page-029","page-030","page-031","page-032","page-033","page-034","page-035","page-036","page-037","page-038","page-039","page-040","page-041"],"artifacts":[{"kind":"translation_page","page_index":1,"path":"projects/mangadistrict-com-title-stupidemic-uncensored/translations/smoke/ch-200c8c840df0/page-001.json"},{"kind":"translation_page","page_index":2,"path":"projects/mangadistrict-com-title-stupidemic-uncensored/translations/smoke/ch-200c8c840df0/page-002.json"},{"kind":"translation_page","page_index":3,"path":"projects/mangadistrict-com-title-stupidemic-uncensored/translations/smoke/ch-200c8c840df0/page-003.json"},{"kind":"translation_page","page_index":4,"path":"projects/mangadistrict-com-title-stupidemic-uncensored/translations/smoke/ch-200c8c840df0/page-004.json"},{"kind":"translation_page","page_index":5,"path":"projects/mangadistrict-com-title-stupidemic-uncensored/translations/smoke/ch-200c8c840df0/page-005.json"},{"kind":"translation_page","page_index":6,"path":"projects/mangadistrict-com-title-stupidemic-uncensored/translations/smoke/ch-200c8c840df0/page-006.json"},{"kind":"translation_page","page_index":7,"path":"projects/mangadistrict-com-title-stupidemic-uncensored/translations/smoke/ch-200c8c840df0/page-007.json"},{"kind":"translation_page","page_index":8,"path":"projects/mangadistrict-com-title-stupidemic-uncensored/translations/smoke/ch-200c8c840df0/page-008.json"},{"kind":"translation_page","page_index":9,"path":"projects/mangadistrict-com-title-stupidemic-uncensored/translations/smoke/ch-200c8c840df0/page-009.json"},{"kind":"translation_page","page_index":10,"path":"projects/mangadistrict-com-title-stupidemic-uncensored/translations/smoke/ch-200c8c840df0/page-010.json"},{"kind":"translation_page","page_index":11,"path":"projects/mangadistrict-com-title-stupidemic-uncensored/translations/smoke/ch-200c8c840df0/page-011.json"},{"kind":"translation_page","page_index":12,"path":"projects/mangadistrict-com-title-stupidemic-uncensored/translations/smoke/ch-200c8c840df0/page-012.json"},{"kind":"translation_page","page_index":13,"path":"projects/mangadistrict-com-title-stupidemic-uncensored/translations/smoke/ch-200c8c840df0/page-013.json"},{"kind":"translation_page","page_index":14,"path":"projects/mangadistrict-com-title-stupidemic-uncensored/translations/smoke/ch-200c8c840df0/page-014.json"},{"kind":"translation_page","page_index":15,"path":"projects/mangadistrict-com-title-stupidemic-uncensored/translations/smoke/ch-200c8c840df0/page-015.json"},{"kind":"translation_page","page_index":16,"path":"projects/mangadistrict-com-title-stupidemic-uncensored/translations/smoke/ch-200c8c840df0/page-016.json"},{"kind":"translation_page","page_index":17,"path":"projects/mangadistrict-com-title-stupidemic-uncensored/translations/smoke/ch-200c8c840df0/page-017.json"},{"kind":"translation_page","page_index":18,"path":"projects/mangadistrict-com-title-stupidemic-uncensored/translations/smoke/ch-200c8c840df0/page-018.json"},{"kind":"translation_page","page_index":19,"path":"projects/mangadistrict-com-title-stupidemic-uncensored/translations/smoke/ch-200c8c840df0/page-019.json"},{"kind":"translation_page","page_index":20,"path":"projects/mangadistrict-com-title-stupidemic-uncensored/translations/smoke/ch-200c8c840df0/page-020.json"},{"kind":"translation_page","page_index":21,"path":"projects/mangadistrict-com-title-stupidemic-uncensored/translations/smoke/ch-200c8c840df0/page-021.json"},{"kind":"translation_page","page_index":22,"path":"projects/mangadistrict-com-title-stupidemic-uncensored/translations/smoke/ch-200c8c840df0/page-022.json"},{"kind":"translation_page","page_index":23,"path":"projects/mangadistrict-com-title-stupidemic-uncensored/translations/smoke/ch-200c8c840df0/page-023.json"},{"kind":"translation_page","page_index":24,"path":"projects/mangadistrict-com-title-stupidemic-uncensored/translations/smoke/ch-200c8c840df0/page-024.json"},{"kind":"translation_page","page_index":25,"path":"projects/mangadistrict-com-title-stupidemic-uncensored/translations/smoke/ch-200c8c840df0/page-025.json"},{"kind":"translation_page","page_index":26,"path":"projects/mangadistrict-com-title-stupidemic-uncensored/translations/smoke/ch-200c8c840df0/page-026.json"},{"kind":"translation_page","page_index":27,"path":"projects/mangadistrict-com-title-stupidemic-uncensored/translations/smoke/ch-200c8c840df0/page-027.json"},{"kind":"translation_page","page_index":28,"path":"projects/mangadistrict-com-title-stupidemic-uncensored/translations/smoke/ch-200c8c840df0/page-028.json"},{"kind":"translation_page","page_index":29,"path":"projects/mangadistrict-com-title-stupidemic-uncensored/translations/smoke/ch-200c8c840df0/page-029.json"},{"kind":"translation_page","page_index":30,"path":"projects/mangadistrict-com-title-stupidemic-uncensored/translations/smoke/ch-200c8c840df0/page-030.json"},{"kind":"translation_page","page_index":31,"path":"projects/mangadistrict-com-title-stupidemic-uncensored/translations/smoke/ch-200c8c840df0/page-031.json"},{"kind":"translation_page","page_index":32,"path":"projects/mangadistrict-com-title-stupidemic-uncensored/translations/smoke/ch-200c8c840df0/page-032.json"},{"kind":"translation_page","page_index":33,"path":"projects/mangadistrict-com-title-stupidemic-uncensored/translations/smoke/ch-200c8c840df0/page-033.json"},{"kind":"translation_page","page_index":34,"path":"projects/mangadistrict-com-title-stupidemic-uncensored/translations/smoke/ch-200c8c840df0/page-034.json"},{"kind":"translation_page","page_index":35,"path":"projects/mangadistrict-com-title-stupidemic-uncensored/translations/smoke/ch-200c8c840df0/page-035.json"},{"kind":"translation_page","page_index":36,"path":"projects/mangadistrict-com-title-stupidemic-uncensored/translations/smoke/ch-200c8c840df0/page-036.json"},{"kind":"translation_page","page_index":37,"path":"projects/mangadistrict-com-title-stupidemic-uncensored/translations/smoke/ch-200c8c840df0/page-037.json"},{"kind":"translation_page","page_index":38,"path":"projects/mangadistrict-com-title-stupidemic-uncensored/translations/smoke/ch-200c8c840df0/page-038.json"},{"kind":"translation_page","page_index":39,"path":"projects/mangadistrict-com-title-stupidemic-uncensored/translations/smoke/ch-200c8c840df0/page-039.json"},{"kind":"translation_page","page_index":40,"path":"projects/mangadistrict-com-title-stupidemic-uncensored/translations/smoke/ch-200c8c840df0/page-040.json"},{"kind":"translation_page","page_index":41,"path":"projects/mangadistrict-com-title-stupidemic-uncensored/translations/smoke/ch-200c8c840df0/page-041.json"}],"warnings":["This is the temporary smoke translation path without canonical character/terminology context; speaker identity remains unset where not safely inferable.","Cross-page speech continuations were preserved at visible page boundaries where applicable.","Raw relay images remained ephemeral and were not committed to normal Git history."],"task_proposals":[],"handoff":{"status":"completed","lease_id":"standalone-lane-stupidemic-ch1-g3","branch":"test/stupidemic-ch1/translation_chunk_test/g3","handoff_path":"work/handoffs/standalone-stupidemic-ch1-g3-translation_chunk_test.json","resume_from":null,"remaining_page_end":null}}